{
  "name": "T2_minimal",
  "grading": [0, 1, 2],
  "chains": {
    "0": {"basis": ["v"], "ring": "Z"},
    "1": {"basis": ["a", "b"], "ring": "Z"},
    "2": {"basis": ["f"], "ring": "Z"}
  },
  "differentials": {
    "1": [[0], [0]],
    "2": []
  },
  "metadata": {
    "version": "1.0.0",
    "author": "Test Author",
    "description": "T2 minimal CW complex - single vertex, two edges, single face"
  }
}
